{
  "contract_type": "enterprise_ai_diagnostic_orchestrator_event",
  "contract_version": "0.1",
  "event_id": "EVENT-SIM-OWNER-TRANSFER-MATERIAL-BLOCKED-001",
  "event_type": "material_analysis_blocked",
  "enterprise_id": "ENT-SIM-BIZOPS",
  "project_id": "PRJ-SIM-CRM-AUTH-001",
  "actor_role": "enterprise_project_owner",
  "authorization_status": "authorized",
  "source_status": "known",
  "payload": {
    "process_id": "PROC-CRM-OWNER-TRANSFER",
    "analysis_ref": "MAT-ANALYSIS-SIM-CRM-OWNER-TRANSFER-001@1",
    "reason": "only_simulated_materials_available",
    "missing_evidence": [
      "authorized_desensitized_oa_sample",
      "authorized_desensitized_excel_sample",
      "authorized_desensitized_crm_log",
      "real_employee_confirmation"
    ],
    "master_record_process_registration": "missing"
  },
  "created_at": "2026-08-16T16:00:00+08:00"
}
