{
  "contract_type": "enterprise_ai_diagnostic_orchestrator_event",
  "contract_version": "0.1",
  "event_id": "EVENT-DIAG-001",
  "event_type": "diagnosis_gate_ready",
  "enterprise_id": "ENT-SIM-RTL",
  "project_id": "PRJ-SIM-RTL-V02",
  "actor_role": "enterprise_project_owner",
  "authorization_status": "authorized",
  "source_status": "known",
  "payload": {
    "process_id": "PROC-COMPLAINT",
    "evidence_pack_ref": "EVIDENCE-V02-001@1",
    "p0_coverage_checked": true,
    "residual_risk_recorded": true
  },
  "created_at": "2026-08-14T13:40:00+08:00"
}
