{
  "contract_type": "enterprise_ai_diagnostic_orchestrator_event",
  "contract_version": "0.1",
  "event_id": "EVENT-MGMT-001",
  "event_type": "management_problem_submitted",
  "enterprise_id": "ENT-SIM-RTL",
  "project_id": "PRJ-SIM-RTL-V02",
  "actor_role": "enterprise_project_owner",
  "authorization_status": "authorized",
  "source_status": "known",
  "payload": {
    "problem_statement": "微信、电话和现场客诉分散，管理层无法确认是否全部登记，也不清楚超时后由谁接管。",
    "requested_outcome": "先识别应优先诊断的业务流程和岗位范围"
  },
  "created_at": "2026-08-14T09:05:00+08:00"
}
