{
  "contract_type": "enterprise_ai_diagnostic_orchestrator_event",
  "contract_version": "0.1",
  "event_id": "EVENT-SIM-CRM-AUTH-PREMATURE-DIAG-001",
  "event_type": "diagnosis_gate_ready",
  "enterprise_id": "ENT-SIM-BIZOPS",
  "project_id": "PRJ-SIM-CRM-AUTH-001",
  "actor_role": "enterprise_project_owner",
  "authorization_status": "authorized",
  "source_status": "known",
  "payload": {
    "process_id": "PROC-CRM-AUTH",
    "evidence_pack_ref": "EVIDENCE-SIM-CRM-AUTH-001@1",
    "p0_coverage_checked": false,
    "residual_risk_recorded": false,
    "simulation_only": true
  },
  "created_at": "2026-08-15T20:00:00+08:00"
}
