{
  "contract_type": "enterprise_ai_diagnostic_orchestrator_event",
  "contract_version": "0.1",
  "event_id": "EVENT-FILE-001",
  "event_type": "file_uploaded",
  "enterprise_id": "ENT-SIM-RTL",
  "project_id": "PRJ-SIM-RTL-V02",
  "actor_role": "employee",
  "authorization_status": "restricted",
  "source_status": "known",
  "payload": {
    "task_id": "TASK-CSR-001",
    "participant_id": "PART-CSR-001",
    "process_id": "PROC-COMPLAINT",
    "material_id": "MAT-TICKET-002",
    "material_type": "ticket_sample",
    "return_to_event": "participant_task_started"
  },
  "created_at": "2026-08-14T10:12:00+08:00"
}
