{
  "contract_type": "enterprise_ai_diagnostic_orchestrator_event",
  "contract_version": "0.1",
  "event_id": "EVENT-PLAN-001",
  "event_type": "interview_plan_confirmed",
  "enterprise_id": "ENT-SIM-RTL",
  "project_id": "PRJ-SIM-RTL-V02",
  "actor_role": "enterprise_project_owner",
  "authorization_status": "authorized",
  "source_status": "known",
  "payload": {
    "owner_confirmed": true,
    "participant_roles": [
      {
        "department_id": "DEPT-STORE",
        "role": "门店客服",
        "process_id": "PROC-COMPLAINT",
        "priority": "P0",
        "planned_participants": 6
      },
      {
        "department_id": "DEPT-STORE",
        "role": "店长",
        "process_id": "PROC-COMPLAINT",
        "priority": "P0",
        "planned_participants": 3
      },
      {
        "department_id": "DEPT-FINANCE",
        "role": "退款审核",
        "process_id": "PROC-REFUND",
        "priority": "P1",
        "planned_participants": 2
      }
    ],
    "participants": []
  },
  "created_at": "2026-08-14T09:40:00+08:00"
}
